<!ELEMENT palinsesto (elemento+)>
        <!ELEMENT elemento (file, id)>
        <!ATTLIST elemento durata CDATA #REQUIRED>
        <!ELEMENT file (#PCDATA)>
        <!ELEMENT id (#PCDATA)>
