<?xml version="1.0" encoding="UTF-8"?>
<!DOCTYPE palinsesto SYSTEM "../palinsesto.dtd">
<palinsesto xmlns:xsi="http://www.w3.org/2001/XMLSchema-instance"
            xsi:noNamespaceSchemaLocation="../palinsesto.xsd">
    <elemento durata="15">
        <file>../../file_html/caffe.html</file>
        <id>C1</id>
    </elemento>
    <elemento durata="10">
        <file>../../file_html/coca_cola.html</file>
        <id>C2</id>
    </elemento>
    <elemento durata="15">
        <file>../../file_html/concessionaria.html</file>
        <id>C3</id>
    </elemento>
    <elemento durata="20">
        <file>../../file_html/serieTV.html</file>
        <id>C6</id>
    </elemento>
    <elemento durata="15">
        <file>../../file_html/sushi.html</file>
        <id>C7</id>
    </elemento>
</palinsesto>